,0,1,2,3,4,5,6,7,8,9,10,11,12,13,14,15,16,17,18,19,20,21,22,23,24,25,26,27,28,29,30
Programmes,Architecture,Biomedical Engineering,Civil Engineering,Clean Energy Technologies,Computing and Control Engineering,Disaster Risk Management and Fire Safety,Energy and Process Engineering,Engineering Animation,Engineering Management,Environmental Engineering,Geodesy and Geomatics,Graphic Engineering and Design,Industrial Engineering,Information Engineering,Information Systems Engineering,Measurement and Control Engineering,Mechanization and Construction Engineering,Mechatronics,Postal Traffic and Telecommunications,Power Software Engineering,"Power, Electronic and Telecommunication Engineering",Production Engineering,Safety at Work,"Scene Architecture, Technique and Design",Software Engineering and Information Technologies,Software Engineering and Information Technologies - Loznica,Technical Mechanics and Technical Design,Traffic and Transport Engineering,null,null,null
Course,Introduction to Programming,Algebra,Computer organisation,Sociology of Technique,Object oriented programming 1,Algorithms and Data structures,Introduction to Software Engineering,Internet Networks,Mathematical analysis,Discrete Mathematics,Object Oriented Programming 2,Data Organization,Numerical Algorithms and Numerical Software,Software Specification and Modeling,Databases,Parallel Programming,System Programming 1,Operating Systems,Software patterns and components,Web programming,Statistics,SCADA Software,Basics of computer engineering,Oral and written communication skills,Internet Software Architectures,Human Computer Interaction,Compilers,Software Development Metrodologies,Software Construction and Testing,Professional Practice – Project,Graduate Thesys
CourseECTS,9,9,5,2,7,7,5,4,9,7,6,5,4,8,4,6,5,7,7,6,5,5,4,5,4,4,5,6,10,null,null
Goals,"Understanding the concepts, elements, and structure of computer programs, and basic algorithms for data processing.","Enabling students to think abstractly and gain new knowledge in the field of elementary, general, abstract and linear algebra, as well as in the fundamentals of classic combinatorics.","Computer organisation fundamentals. Architecture, principals and implementations.","Enabling engineers to understand social importance and role of technical sciences in the society development, positive and negative implications of technical sciences to the development of society and men, as well as self social importance and responsibility in the creation of human society.",Make students capable of solving problems in object oriented programming area.,Introduce students to concepts of in-memory data structures and their use in program development.,"Training students to apply modern methods, tools and best practices in the software development process.",Students learn about the theoretical bases and technologies of TCP/IP networks.,"Enabling students to think abstract and gain basic knowledge in the field of Mathematical analysis (limiting processes, differential and integral calculus, ordinary differential equations).","Enabling students to think abstractly and gain new knowledge in the field of classical combinatorial objects, nonclassical combinatorial objects and graph theory.",Getting familiar with advanced concepts of object oriented approach using C++. Software development by simultaneous utilization of various programming approaches (multi-paradigm programming).,"Basic students' education in the area of file organization, as well as physical data structures implemented at external memory devices. Geting knowledge about development and use of file systems.","Students gain basic knowledge about numerical analysis, methodology of applying numerical models in engineering disciplines, use of selected standard numerical software tools.",Students learn about efficient and effective modeling and specification of software systems. They gain knowledge and skills necessary for analysis and specification of software requirements. They learn the basics of model based design. They learn about UML specifications.,Teaching students parallel programming of parallel computer architectures.,Teaching students design and implementation of real-time system software components with focus on software tools for real time systems.,"Introduce students to the concept of an operating system, its basic parts and structure, principles of operation, as well as ways for its implementation.","Learning basic theoretical knowledge, techniques, tools and recommended practices in the field of software patterns  (Software Patterns) </ eng> and software development based on components  (Component-Based Development - CBD) </ eng>.
Students learn to detect patterns in the context of the development of complex software products as well as defining the system architecture based on software components.","Students learn to solve problems in the field of Web programming, which covers knowledge of HTTP protocols, Server and JSP technology as well As organization and architecture of web applications.",Ability of abstract thinking and acquiring basic knowledge in the area of probability and statistics and stochastic processes,The goal of this course is to acquire the necessary knowledge about the SCADA software.,Basics of digital system design,Training students for oral and written professional communication.,Students gain knowledge about the design and construction of multilevel client/server systems based on distributed object technology.,Students learn to design and implement basic forms of human computer interaction.,"Introduce students to the principles of compiler, translating concepts (from one programming language to another), the tools for their production and means of implementation. Mastering the compiler making at the beginner level.","Introducing students to the software products lifecycle and to methodologies, standards and tools that support software product throught the whole of its lifecycle or in any of its phases","Students learn how to apply recommended practices, methods, techniques and tools in the area of software design and testing.","Izrada završnog rada ima za cilj objedinjavanje, potvrđivanje i praktičnu primenu stečenih znanja tokom studija. Student ima pravo da radi završni rad iz uže stručnih predmeta koji se izučavaju u okviru studijskog programa.",null,null
Outcomes,"Upon successful completion of this course students gain understanding of main computer program concepts and are able to write programs that interact with users; handle different types of data; use basic structural concepts in programming - sequences, selections, and iterations; use subprograms and decompose complex programs; understand elements of software development process; understand elements of algorithm analysis.",Acquired knowledge is used in further education and professional courses. Mathematical models are designed and solved in professional courses using the material from this course.,"Introduction to organisation of computers, principles and most important parts. Evaluation of efficiency of computing operations. Classification of architectures and parts.","Acquisition of social knowledge about features, sources, social functions and creators of technical knowledge; knowledge about the impact of the nature of social systems on technical development and the impact of technique on the society development; knowledge about impact of technique on globalization process, nature destruction and creation of risky society; knowledge about impact of technique on changes of the work contents and work organization forms; knowledge about the impact of the mass media on people’s lives, education, culture and democracy.","Learning methods, technologies and standards for development of object oriented applications. Java programming language is used for this course.","Upon successful course completion, student is familiar with abstract data types and capable of handling linear data structures - arrays, sets, maps, lists, stacks, queues; Student is also familiar  with basic concepts of program efficiency analysis; Student is capable of using search and sort methods on data structures; Student understands the concept of recursiond and its use in program development; Student understands and use hash tables as well as tree structures.","Upon successful completion of the course the student is able to: use modern techniques and tools in software development (integrated environment, editors, compilers, debugers etc.); successfully cooperates in team development of software products using tools for collaboration, control systems versions and systems for tracking requests for changes; writes unit, integration and acceptance tests; understands the benefits of software controlled testing, understands and use basic methdological approaches to software development; writes documentation and uses tools for writing documentation for evolving software.","Understanding basic theory about TCP/IP networks. Gaining practical knowledge necessary for design, implementation and maintenance of local computer networks based on TCP/IP model.",Acquired knowledge is used in further education and student designs and solves mathematical models in professional courses using the knowledge from Mathematical Analysis 1.,Acquired knowledge is used in further education and professional courses. Mathematical models are designed and solved in professional courses using the material from this course.,"After finishing the course the students are familiar with possibilities of C++; they can efficiently utilize the components of standard library; they understand the principles of the object oriented approach; knows the advantages and disadvantages of the programming language, and he can recognize the engagements where it is justified to use C++; he is aware of the language specific support for various programming approaches, and knows the pros and cons for those approaches.","The acquired knowledge is used in practice and in the Databases course, as well as in future engineering courses. After completing the course, students understand principles of file organization and data management systems.",Understanding basic numerical models and ability to apply them for solving simple engineering tasks using numerical software tools.,"After successfully finishing the course the students have these abilities: analysis of complex systems, specification of requirements according to the system and software and application of UML formalisms with modeling static and dynamic behavior of system and software.","Ability to write parallel programs for parallel computer architectures by using parallel programming patterns, models, and tools.","Ability to design and implement real-time system software components, including software tools for real-time systems (assembler, macro assembler, compiler, etc.).","Upon course completion students are familiar with the main parts of the operating system, its working principle and structure. They have appropriate understanding and knowledge of the different types of operating systems and their properties, understanding the meaning of the basic parameters of the operating system, and are able of practical application of the knowledge acquired.","Upon completion of the course students are able to recognize patterns and to understand their advantages and disadvantages in the development of complex software applications. They are also capable, for the task at hand, to select and apply the most appropriate component-based development platform, define system architecture through the decomposition into software components, define their interfaces and do the system implementation.
",The acquired knowledge forms the basis for the future engineering courses.,Student is competent to design and solve mathematical models in the field of probability and statistics in further education and professional courses.,"Outcomes are the knowledge, skills and abilities necessary for understanding the complexity of SCADA software and solve practical engineering problems.",Knowledge about the basic techniques for designing and testing digital systems. The acquired knowledge provides the basis for understanding engineering courses which will follow.,Ability to communicate professional content in written form in native and English language. Ability to communicate professional content in oral form in native and English language. ,"Knowledge about technologies and standards for construction of multilevel client/server systems. Students are competent to design multilevel, distributed software systems based on distributed object technology.",The acquired knowledge and skills are the basis for developing software of high utility capacity in the future courses and professional life.,"Upon successful completion of the course students are familiar with the principles of compiler; thez have knowledge of compiling phases, use techniques to translate from one language to another; they are capable of using tools for compiler-generated and real scanners, parsers and simple compilers.","Upon successful completion of the course the student is familiar with various methodologies for software development, as well as standards and tools that support them. The student is also able to select and actively implement optimal methodology and tools for particular software project, as well as to explain this choice.","Knowledge of the principles, techniques and tools for software construction and testing. Students are competent to perform planning and design of software. They are able to perform the automation of the testing process, to test the entire software or selected units. They will be able to perform the analysis and selection of tools for testing, to create test cases and to implement effective software testing.","Sposobnost učešća u realizaciji složenih projekata, sposobnost razumevanja specifikacija, kritičkog osvrta na moguća rešenja. Primena stečenih inženjerskih znanja i veština za rešavanje konkretnog problema, na osnovu dobijenih specifikacija. Sposobnost pisanja rada u zadatoj formi. Sposobnost jasnog i prihvatljivog obrazloženja implementiranog rešenja.",null,null
